{
  "indexVersion": 1,
  "target": {
    "id": "https://example.com/moca/support-kb",
    "version": "4.2.0",
    "digest": "sha256:af2cdf985406ba1f8706c87493ca9a92524cd1f1f77c90169ff2bc44ce1c9e18"
  },
  "indexType": "lexical",
  "chunking": {
    "strategy": "headings-h1-h3"
  },
  "storage": {
    "format": "moca-jsonl-v1",
    "file": "payload/items.jsonl"
  },
  "createdBy": "moca-index"
}
